<!DOCTYPE employees [
<!ELEMENT employees (employee+)>
<!ELEMENT employee (name, id, department)>
<!ELEMENT name (#PCDATA)>
<!ELEMENT id (#PCDATA)>
<!ELEMENT department (#PCDATA)>
]>
